{
  "canonical_digest": "51494b26a1b5dfe940dcb0d8d7673ff099c2913edd6d751c38169178883796ce",
  "canonical_revision": 75,
  "github": {
    "network_verification": "ON_DEMAND",
    "receipts": {}
  },
  "markdown": {
    "CR-0001": {
      "canonical_revision": 75,
      "path": "engineering/changes/CR-0001.md",
      "state_fingerprint": "180eb85a99a2ba6e7b01bbf5dd69e9206ff7a9d15cba84fd74cc31adf2a54c5f"
    },
    "CR-0002": {
      "canonical_revision": 75,
      "path": "engineering/changes/CR-0002.md",
      "state_fingerprint": "9dc1dbc86e629ebeebd1f4b99abc057d28c0fc42794d055a5a2fa28114dcebc2"
    },
    "CR-0003": {
      "canonical_revision": 75,
      "path": "engineering/changes/CR-0003.md",
      "state_fingerprint": "e2650699492fdc06fd18c2de83765d94c8c3ed8c79857fdf399c496d13cbb34d"
    },
    "MNT-0001": {
      "canonical_revision": 75,
      "path": "engineering/maintenance/MNT-0001.md",
      "state_fingerprint": "102d85b2a74875d244c92555f8217b50b57650b6317fe68f69838d96dae2111e"
    },
    "MNT-0002": {
      "canonical_revision": 75,
      "path": "engineering/maintenance/MNT-0002.md",
      "state_fingerprint": "56c17cb71f98d49302cf01f5e49fa806c6cb329bc6e671a91ed375aa43b8e97c"
    },
    "MNT-0003": {
      "canonical_revision": 75,
      "path": "engineering/maintenance/MNT-0003.md",
      "state_fingerprint": "ac5b79d6841243262a21f124a0d5d7fd149730f871a8754656ce7fbde0c59db1"
    },
    "MNT-0004": {
      "canonical_revision": 75,
      "path": "engineering/maintenance/MNT-0004.md",
      "state_fingerprint": "dbff400fe66afcf5ad54d36e97510ad810e54cd82a1db720d0f80089bb13db94"
    },
    "MNT-0005": {
      "canonical_revision": 75,
      "path": "engineering/maintenance/MNT-0005.md",
      "state_fingerprint": "b99399e5fc6d70cae4ccb8f42d62ba0fca5a7e2be321c1c88664cc7c3dd44f59"
    },
    "MNT-0006": {
      "canonical_revision": 75,
      "path": "engineering/maintenance/MNT-0006.md",
      "state_fingerprint": "d0438deec8688ff7777ba1c39cb064be0e09bdd0a73a113890485f692bc7c2ae"
    },
    "PI-001": {
      "canonical_revision": 75,
      "path": "engineering/increments/PI-001.md",
      "state_fingerprint": "7995f66d00fbb35a304f638fee50eab9ce215fc9c2d95467f159c8afd08130df"
    },
    "PI-MVP-001": {
      "canonical_revision": 75,
      "path": "engineering/increments/PI-MVP-001-SEMANTIC-FOUNDATION.md",
      "state_fingerprint": "0a7dfdfef70147df5c9113e9eda72d70318dca8394fa3a431feeb21a970a9d6e"
    },
    "WC-0001": {
      "canonical_revision": 75,
      "path": "engineering/work-cycles/WC-0001.md",
      "state_fingerprint": "4a0b412667e615192e9b101cbab14dd83ad239ea1efc8801338c89cfa71e5582"
    },
    "WC-MVP-0001": {
      "canonical_revision": 75,
      "path": "engineering/work-cycles/WC-MVP-0001.md",
      "state_fingerprint": "adbc93025665ad0dbe290aa0bde2f4b39f8043a70ef4d2185bb77366d66d96a8"
    },
    "WC-MVP-0002": {
      "canonical_revision": 75,
      "path": "engineering/work-cycles/WC-MVP-0002.md",
      "state_fingerprint": "dbdc43ba06aecbef007d3fa9ab2b8475ea62b1c2d7d4948fb109e1b6fbf138b4"
    },
    "WP-0001": {
      "canonical_revision": 75,
      "path": "engineering/work-packets/WP-0001.md",
      "state_fingerprint": "57cfc886fe622fcc33432d6c231db6380c0d4c96fb114785fe2c3c9bd21b817f"
    },
    "WP-MVP-0001": {
      "canonical_revision": 75,
      "path": "engineering/work-packets/WP-MVP-0001.md",
      "state_fingerprint": "c72b0b373ac0945cdaf365aba2f5e68dab09fe1837ffeb8036302d3694d2b8d4"
    },
    "WP-MVP-0002": {
      "canonical_revision": 75,
      "path": "engineering/work-packets/WP-MVP-0002.md",
      "state_fingerprint": "388f7e2a4bd395edf612b2395f720135da8f143ca7debde307d4c3cbc7fb039b"
    },
    "WP-MVP-0003": {
      "canonical_revision": 75,
      "path": "engineering/work-packets/WP-MVP-0003.md",
      "state_fingerprint": "d59a6bd5d2ed061502954cad09bb3b5c3f4393cda60a4bb290a9b4c2e5019913"
    },
    "WP-MVP-0004": {
      "canonical_revision": 75,
      "path": "engineering/work-packets/WP-MVP-0004.md",
      "state_fingerprint": "506a0d877f73fed203d0dd147230d7e9bfd1d6e8a156cce92b69da1865e199a0"
    },
    "WP-MVP-0005": {
      "canonical_revision": 75,
      "path": "engineering/work-packets/WP-MVP-0005.md",
      "state_fingerprint": "6150a89fcb0f28784de6e74bf6fc54fbf067b5b42463c66bd6b7fcb1392bf1dc"
    }
  },
  "policy": {
    "canonical": {
      "path": ".eos/state/current.json",
      "role": "SOLE_OPERATIONAL_AUTHORITY",
      "write_policy": "EOS_TRANSACTION_ONLY"
    },
    "event_ledger": {
      "canonical_current_state": false,
      "path": ".eos/events.jsonl",
      "role": "APPEND_ONLY_MUTATION_HISTORY"
    },
    "git": {
      "canonical_current_state": false,
      "role": "VERSION_HISTORY_AND_INTEGRITY_LEDGER"
    },
    "github": {
      "external_edits": "DRIFT_UNTIL_EXPLICIT_RECONCILIATION",
      "role": "SYNCHRONIZED_COLLABORATION_PROJECTION",
      "write_back_policy": "NEVER_IMPLICIT"
    },
    "markdown": {
      "content_authority": "GOVERNED_HUMAN_ARTIFACT",
      "drift_policy": "FAIL_CLOSED_FOR_LIFECYCLE_METADATA",
      "lifecycle_fields": "PROJECTION_OF_CANONICAL_STATE",
      "role": "HUMAN_READABLE_GOVERNED_ARTIFACT"
    },
    "tsv": {
      "drift_policy": "FAIL_CLOSED",
      "role": "GENERATED_COMPATIBILITY_PROJECTION",
      "write_policy": "READ_ONLY_OUTSIDE_EOS"
    }
  },
  "schema_version": "1.0.0",
  "tsv": {
    ".eos/change-requests.tsv": {
      "actual_sha256": "6d2ed57ccc514accf5fc215bc58dd5f491dab530af7d1833ee3bfda81f10f51d",
      "canonical_revision": 75,
      "expected_sha256": "6d2ed57ccc514accf5fc215bc58dd5f491dab530af7d1833ee3bfda81f10f51d"
    },
    ".eos/maintenance.tsv": {
      "actual_sha256": "d3995246a4a3ab89a6d16194fb53fedb17e3069bac0e82f01b0237a5873d494d",
      "canonical_revision": 75,
      "expected_sha256": "d3995246a4a3ab89a6d16194fb53fedb17e3069bac0e82f01b0237a5873d494d"
    },
    ".eos/program-increments.tsv": {
      "actual_sha256": "de36986d866673ebe6210299ace0dfa55b91829584f8af3532f7b4aa25818e7d",
      "canonical_revision": 75,
      "expected_sha256": "de36986d866673ebe6210299ace0dfa55b91829584f8af3532f7b4aa25818e7d"
    },
    ".eos/releases.tsv": {
      "actual_sha256": "fbd66de69e6c5882faf4d33ae64250e9921c25739a0807152433bd817ef986f9",
      "canonical_revision": 75,
      "expected_sha256": "fbd66de69e6c5882faf4d33ae64250e9921c25739a0807152433bd817ef986f9"
    },
    ".eos/work-cycles.tsv": {
      "actual_sha256": "8f6ac75fbb817c20e729fc7dafb993fa902c9218ceb2d4166378b6d704b7e2f2",
      "canonical_revision": 75,
      "expected_sha256": "8f6ac75fbb817c20e729fc7dafb993fa902c9218ceb2d4166378b6d704b7e2f2"
    },
    ".eos/work-packets.tsv": {
      "actual_sha256": "f57ea96c4b77111c2ba1b81abf564f73caa41f7d8dfdd7a003d7952e751e76e2",
      "canonical_revision": 75,
      "expected_sha256": "f57ea96c4b77111c2ba1b81abf564f73caa41f7d8dfdd7a003d7952e751e76e2"
    }
  }
}
